{
  "recipe": "axis.decomposed.timbleCallback.okCheck",
  "lender": "axis",
  "inputs": { "ok": "bool" },
  "outputs": {},
  "outcomes": ["TIMBLE_OK", "TIMBLE_FAILED"],
  "steps": [
    { "id": "check", "when": "input.ok", "return": { "outcome": "TIMBLE_OK" } }
  ],
  "return": { "outcome": "TIMBLE_FAILED" }
}
