{
  "recipe": "axis.decomposed.dedupe.buildAndCall",
  "lender": "axis",
  "inputs": { "customer": "map", "clientLoanId": "string" },
  "outputs": { "applicantId": "string" },
  "outcomes": ["OK", "REJECTED"],
  "steps": [
    { "id": "request", "op": "map.axis.precheckRequest@1", "in": { "customer": "input.customer", "clientLoanId": "input.clientLoanId" } },
    { "id": "call", "op": "axis.precheck.invoke@1", "in": { "type": "'dedupe'", "body": "steps.request.value" },
      "onError": { "BUSINESS": "return:REJECTED" } }
  ],
  "return": { "outcome": "OK", "out": { "applicantId": "steps.call.applicantId" } }
}
