{
  "recipe": "axis.decomposed.status.call",
  "lender": "axis",
  "inputs": { "body": "map" },
  "outputs": { "dedupe": "string", "pan": "string", "ramp": "string", "hunter": "string" },
  "outcomes": ["OK"],
  "steps": [
    { "id": "call", "op": "axis.precheck.status@1", "in": { "body": "input.body" } }
  ],
  "return": { "outcome": "OK", "out": {
      "dedupe": "steps.call.dedupe", "pan": "steps.call.pan", "ramp": "steps.call.ramp", "hunter": "steps.call.hunter" } }
}
