{
  "recipe": "axis.decomposed.dedupe.saveRerun",
  "lender": "axis",
  "inputs": { "loanRequestId": "string", "customerId": "string", "applicantId": "string", "clientLoanId": "string" },
  "outputs": {},
  "outcomes": ["OK"],
  "steps": [
    { "id": "saveRerun", "op": "axis.precheck.saveDedupeRerun@1", "in": {
        "loanRequestId": "input.loanRequestId", "lender": "'axis'", "customerId": "input.customerId",
        "applicantId": "input.applicantId", "clientLoanId": "input.clientLoanId" } }
  ],
  "return": { "outcome": "OK" }
}
