{
  "recipe": "axis.decomposed.auditInsert",
  "lender": "axis",
  "inputs": { "loanRequestId": "string", "customerId": "string", "loanProcess": "string", "status": "string", "remarks": "string" },
  "outputs": {},
  "outcomes": ["OK"],
  "steps": [
    { "id": "audit", "op": "precheck.audit.insert@1", "in": {
        "loanRequestId": "input.loanRequestId", "lender": "'axis'", "customerId": "input.customerId",
        "loanProcess": "input.loanProcess", "status": "input.status", "remarks": "input.remarks" } }
  ],
  "return": { "outcome": "OK" }
}
