{
  "recipe": "axis.decomposed.statusPersist.saveFinal",
  "lender": "axis",
  "inputs": { "loanRequestId": "string", "dedupe": "map", "pan": "map", "ramp": "map", "hunter": "map", "overall": "map", "approvedFlag": "string" },
  "outputs": {},
  "outcomes": ["OK"],
  "steps": [
    { "id": "save", "op": "axis.precheck.saveStatusFinal@1", "in": {
        "loanRequestId": "input.loanRequestId", "lender": "'axis'", "dedupe": "input.dedupe", "pan": "input.pan",
        "ramp": "input.ramp", "hunter": "input.hunter", "overall": "input.overall", "approved": "input.approvedFlag == 'true'" } }
  ],
  "return": { "outcome": "OK" }
}
