{
  "recipe": "axis.decomposed.timbleCallback.decide",
  "lender": "axis",
  "inputs": { "event": "map" },
  "outputs": { "ok": "bool", "customerId": "string", "status": "string", "message": "string" },
  "outcomes": ["OK"],
  "steps": [
    { "id": "decide", "op": "map.value@1", "in": {
        "value": "cel.bind(n, rk.str(input.event.?name_match.orValue(null), '').trim().upperAscii(), cel.bind(a, rk.str(input.event.?aadhar_match.orValue(null), '').trim().upperAscii(), cel.bind(ok, !(n == 'N' || a == 'N'), {'ok': ok, 'customerId': rk.str(input.event.?customer_id.orValue(null), ''), 'status': ok ? 'SUCCESS' : 'FAILURE', 'message': ok ? 'Timble Precheck Successful' : 'Timble Precheck Failure : ' + rk.json({'timble_error_message': input.event.?timble_error_message, 'aadhar_match': input.event.?aadhar_match, 'name_match': input.event.?name_match})})))" } }
  ],
  "return": { "outcome": "OK", "out": {
      "ok": "steps.decide.value.ok", "customerId": "steps.decide.value.customerId",
      "status": "steps.decide.value.status", "message": "steps.decide.value.message" } }
}
